{
  "$schema": "https://json-schema.org/draft/2020-12/schema",
  "$id": "https://cy-llm.dev/schemas/manifests/artifact_manifest.schema.json",
  "$comment": "MIGRATING_COMPATIBILITY: implemented v0 AI artifact projection; frozen for compatibility and not a current Platform authority.",
  "title": "ArtifactManifest",
  "description": "An immutable description of a managed artifact (model snapshot, dataset, checkpoint, merged/quantized model, or report). Its `artifact_id` is a content hash of the record with the `artifact_id` field itself excluded (see schemas/CANONICALIZATION.md).",
  "type": "object",
  "additionalProperties": false,
    "required": ["kind", "integrity", "lineage"],
    "properties": {
    "schema_version": { "type": "string", "description": "Optional version of the canonical artifact manifest schema." },
    "artifact_id": {
      "type": "string",
      "description": "Computed content id, format 'sha256:<hex>'. EXCLUDED from the canonical hash preimage; treat as output only.",
      "pattern": "^sha256:[0-9a-f]{64}$"
    },
    "kind": {
      "type": "string",
      "description": "Kind of artifact.",
      "enum": ["generic", "model", "dataset", "checkpoint", "training_spec", "metrics", "merged", "quantized", "report"]
    },
    "source": { "type": "string", "description": "Where the artifact originated, e.g. a model ref or upstream URL (optional)." },
    "integrity": {
      "type": "string",
      "description": "Content digest of the artifact payload used for dedup and integrity, format 'sha256:<hex>'.",
      "pattern": "^sha256:[0-9a-f]{64}$"
    },
    "size_bytes": { "type": "integer", "minimum": 0, "description": "Total artifact size in bytes (optional)." },
    "lineage": {
      "type": "object",
      "description": "Provenance links binding the artifact to its inputs.",
      "additionalProperties": false,
      "required": ["revision_chain"],
      "properties": {
        "base_model_revision": { "type": "string", "description": "Reference to the base model revision this artifact derives from (optional)." },
        "dataset_digest": {
          "type": "string",
          "description": "Digest of the dataset used, format 'sha256:<hex>' (optional).",
          "pattern": "^sha256:[0-9a-f]{64}$"
        },
        "runtime_id": {
          "type": "string",
          "description": "Reference to the RuntimeManifest that produced the artifact, format 'sha256:<hex>' (optional).",
          "pattern": "^sha256:[0-9a-f]{64}$"
        },
        "revision_chain": {
          "type": "array",
          "description": "Ordered chain of TrainingRevision ids leading to this artifact.",
          "items": { "type": "string" }
        },
        "checkpoint_id": {
          "type": "string",
          "description": "Reference to the source checkpoint, format 'sha256:<hex>' (optional).",
          "pattern": "^sha256:[0-9a-f]{64}$"
        }
      }
    },
    "ref_count": { "type": "integer", "minimum": 0, "description": "Number of references to this artifact (optional; not part of the immutable identity in practice but retained for completeness)." }
  }
}
