{
  "artifact_id": "sha256:0000000000000000000000000000000000000000000000000000000000000000",
  "kind": "merged",
  "source": "Qwen/Qwen2.5-7B",
  "integrity": "sha256:cccccccccccccccccccccccccccccccccccccccccccccccccccccccccccccccc",
  "size_bytes": 15221125120,
  "lineage": {
    "base_model_revision": "Qwen/Qwen2.5-7B@main",
    "dataset_digest": "sha256:dddddddddddddddddddddddddddddddddddddddddddddddddddddddddddddddd",
    "runtime_id": "sha256:91fe1b35cf0dfd7f5162ef0895cd288e094111add6e8ec136fdda445d11b5445",
    "revision_chain": [
      "sha256:1111111111111111111111111111111111111111111111111111111111111111",
      "sha256:2222222222222222222222222222222222222222222222222222222222222222"
    ],
    "checkpoint_id": "sha256:3333333333333333333333333333333333333333333333333333333333333333"
  },
  "ref_count": 2
}
